"Movie Title","Review","Score","Genres"
"collide_2017","'Despite the hammy charades from both Kingsley and Hopkins, 'Collide' has to contend with poor camera work, cheap-looking action scenes and bland characters'DVD Movie Review: CollideDate Viewed: June 8 2017Directed By Eran Creevy (Welcome to the Punch)Screenplay By F. Scott Frazier and Eran Creevy, Story By F. Scott FrazierStarring: Nicholas Hoult, Felicity Jones, Ben Kingsley, Anthony Hopkins, Marwan Kenzari, Clemens Schick, Erdal Yildiz, Michael Epp, Aleksandar Jovanovic and Markus Klauk.No multi-car pile up on the highway could possibly explain the absurdity of 'Collide'. It's an action-thriller that has two bland performances and two highly over-the-top performances. It's supposed to be an action movie about an American living in Germany who has to save the love of his life by doing one last job for his drug kingpin boss but 'Collide' seems more interested in car-crashing than telling a lively story.Nicholas Hoult stars as Casey Stein, an American who's now living in Germany so that he can evade from the law back home. Casey did some bad things at home and now he's trying to start a new life in Germany. After telling his employer and drug smuggler, Geran (Ben Kingsley) he wants out, Casey starts to take control of his life until he meets another American at a nightclub. Her name is Juliette Marne (Felicity Jones) and they immediately fall for each other. Suddenly, Juliette faints to the ground and when she and Casey arrive at the hospital, the doctors inform Juliette that one of her kidneys has failed.Juliette needs a transplant immediately but she's not qualified to get one because she's not a citizen of Germany. This sad and terrible situation leaves Casey with no choice. He must return to his employer and ask for a job in order to secure the $250,000 he needs to go back to America and get Juliette the transplant she needs despite the fact that Casey is still a wanted man.Geran wants Casey to steal a precious cargo of cocaine-filled golf balls from another big drug kingpin but this one is more ruthless than him. This drug dealer and mob boss happens to be Hagen Kahl (Anthony Hopkins), Geran wanted to be partners with Hagen but he turned him down which left Geran angry and furious and now he seeks payback time. When the heist goes terribly wrong, Casey gets kidnapped by Hagen but he miraculously escapes and the movie turns into a low-rent 'Fast & Furious' rip-off. Casey's actions get repeated over and over again throughout, Casey steals a car, Casey crashes the car, Casey miraculously escapes from either Hagen's henchmen or the German authorities, he steals another car, he crashes another car, he miraculously escapes from the bad guys, he steals another car and yeah, you get the idea. Casey's dumb actions seem to the formula for this movie and it's annoying as F$&@!While he crashed Hagen's car, Casey manages to find $5 million in the automobile and he takes all of it and Hagen not only plans on getting the money back, he also desires in finding Casey's girlfriend. Fearing for Juliette's safety, Casey calls Geran to protect her from Hagen and his thugs before they can get to her. Nicholas Hoult is really bad here as Casey because he just makes one dumb decision after another and Felicity Jones is totally miscast as Casey's girlfriend who desperately needs a kidney transplant.As for Kingsley and Hopkins, their performances reach tremendous levels of awkward and hilarity. Kingsley's character not only has a bad Turkish accent, he really loves the 1985 John Travolta/Jamie Lee Curtis film 'Perfect' which was deemed so horribly bad by many film critics and he even thinks that Travolta should've won an Oscar for it and he also has a strange obsession for Burt Reynolds. Oh wait! there's more, Hopkins even does an impression of Sylvester Stallone. It's hard to fathom or believe that a knighted Oscar-winner would do an impression of him. I'll admit that it is fascinating to watch and I had a good laugh but this is the kind of zany impressions Hopkins can do on 'The Tonight Show with Jimmy Fallon'.The screenplay by director Eran Creevy (Welcome to the Punch) and F. Scott Frazier (XXX: Return of Xander Cage) is filled with plot holes, not so colorful dialogue and the action is just an exhausting cycle of wham and bam. Despite the hammy charades from both Kingsley and Hopkins, 'Collide' has to contend with poor camera work, cheap-looking action scenes and bland characters.","10","Mystery & Suspense, Action & Adventure"
"collide_2017","Collide dialogue is really cliche and tests my patience at times, but the action does keep you entertained. I would recommend this film more as a rental then something you go see at a theater.","20","Mystery & Suspense, Action & Adventure"
"collide_2017","Very good intense thrilling and spectacular movie.","30","Mystery & Suspense, Action & Adventure"
"collide_2017","Collide is deceptively good. Everything about it screams 'stay away' and 'generic.' And to an extent it is generic. None of its pieces yield any sort of base creativity, but all put together in just the right mixture the movie far and away exceeds expectations with a perfectly balanced assault of characterization, car chases, gun play, and intensity. It's never hyper real, and it's never gritty real. It's just a good, adrenaline-fueled movie that won't go down in the history books but that really nails that sweet spot for charged, contemporary action.","35","Mystery & Suspense, Action & Adventure"
"collide_2017","This was a great action movie ever! I loved this movie a lot because it's action sequences are great and the whole movie is phenomenal! It's a must see! You don't want to miss one of the greatest action movies of all time!","50","Mystery & Suspense, Action & Adventure"
"collide_2017","Um ex-bandido americano vai para a Europa e abandona o crime por amor, porém acaba retornando ao crime para conseguir dinheiro para bancar a operação de sua namorada... nessa confusão acaba sendo preso roubando de um dos maiores criminosos e tem que fugir até cansar, e no final faz uma delação premiada e entrega geral...","45","Mystery & Suspense, Action & Adventure"
"collide_2017","Quick money always ends in a big trouble!It's one of those films with aimless narration. Indeed, it has a nice cast and characters with the basic storyline, but that did not expand and explored well as it should have been. At least the pace of the narration looked fine. Some characters looked unnecessary, and so a couple of scenes. If these all were managed, then still it could have been a decent film. Because since it is an action- adventure, they did not generate those crucial parts like the stunts and dialogues related to the gangster thing to turn it a better film in its kind.The two veteran actors coming together for the first time added more curiosity than flavour we are looking for. They did okay and so the rest of the cast. Ideal runtime, a few stuffs were in the favour of the film, but those were not enough for the overall success. If the same film was made from the non-English world like perhaps Germany, which was one of the producers of the film would have done better than this existing one which is very familiar with this language.People would watch it only for Hopkins and Kingley and so did am I. But they might end in disappointment, or that could be the reason to rate it fairly better. Whatever, this is an okay film, which is barely entertaining and of all, not a boring film. So trying it for one is okay, but I think not worth if you have got plenty of options over this one.6/10","30","Mystery & Suspense, Action & Adventure"
"collide_2017","Big cast little interest, 15 mins binned","05","Mystery & Suspense, Action & Adventure"
"collide_2017","Collide is a by-the-book action thriller with the typical car chases, gunfire, and stolen cash. Nicholas Hault is the lesser of two great actors in this film starring alongside Ben Kingsley and Anthony Hopkins, perhaps that one reason why his acting felt too cheesy at times.","20","Mystery & Suspense, Action & Adventure"
"collide_2017","l am not their heavily me it just hard l can stop this, there are few cast and l don't get it, then simply help him find the money then get in cars recusced girlfriend who just kidnapped from medical hositpal after he love her what getting back.","20","Mystery & Suspense, Action & Adventure"
"collide_2017","A girl (Felicity Jones) needs a new kidney, his guy (Nicholas Hoult) is ready to do anything to get the money needed. So he gets back to his old criminal life, getting stuck between feuding gangsters (Anthony Hopkins, Ben Kingsley).'Collide' is functional, fast-paced and sometimes fun, if ultimately uninvolving actioneer. I have mostly positive things to say about it althought the result is not good enough to earn a recommendation.There will be a lot of shooting, punching and fast cars to satisfy the genre fan who just wants to see something new. The movie also has legendary actors Kingsley and Hopkins together on screen for the first time. And the young stars will not disappoint.But the screenplay is so sloppy that it's hard to stay invested. Firstly I didn't quite buy the main story arc of young petty thief outmaneuvering two veteran criminals with small armies, especially because it was done the cheapest way possible (sudden twists whenever convenient for storytellers). I also didn't buy the young hero as a guy never making mistakes or even getting hit hard, although he was constantly hunted by men who work as killers, and have a lot of shooting experience.Also, the story sits uncomfortably between two chairs, being neither serious enough nor tongue-in-cheek enough. You can't take it as a top-shelf actioneer, and it's not quite a flamboyant eurotrash either (many of the Jason Statham movies).As result, some of the stuff works (the beginning, action scenes), some not. Story becomes progressively more stupid, and Hopkins and Kingsley playing 'colorful' gangsters is like a ham-fisted parody of their roles in earlier, better movies.At least young stars are doing good work. Jones is cute enough to justify all this punching and shooting, and it's always good to see Hoult ('About a Boy', the newest 'Mad Max', Hank / Beast in 'X-Men') in a role which doesn't serve as just a window dressing.If he got a movie role as big and colorful as in the first season of TV series 'Skins', he could be the next Hollywood hero. He looks good in action too.","25","Mystery & Suspense, Action & Adventure"
"collide_2017","'Collide' is a knock-off 'Fast and the Furious' film about a hustler trying to make a better life for his ailing girlfriend (Felicity Jones). When a deal goes bad between two German drug lords (Ben Kingsley, Anthony Hopkins), Kingsley consigns the guy to steal a shipment of cocaibe from Hopkins. What ensues is a cheesy, third rate damsel in distress tale with cars that we've seen a million times before. The characters are static, and the action is whirlwind and confusing. This fim is also lookist and despite having entertainment value is a knock off rip off of better kidnap plots involving drugs and cars ------------------------------------ C","20","Mystery & Suspense, Action & Adventure"
"collide_2017","It was good but could have been better the car chases were good and the little action that was in it was not bad either. Safe to say you don't have to see right away but it's a good home movie to watch.","30","Mystery & Suspense, Action & Adventure"
"collide_2017","Dreadful dialogue, and the love story between the two leads just purely lack any chemistry. Get the DVD though, the action scenes are actually good when they happen.","20","Mystery & Suspense, Action & Adventure"
"collide_2017","Great story, superb acting, lots of action","50","Mystery & Suspense, Action & Adventure"
"collide_2017","Terrible plot, a great cast that just showed up for a paycheck, although there are a couple of good chase scenes. 40/100.","20","Mystery & Suspense, Action & Adventure"
"collide_2017","'Collide' aka 'Autobahn' is a poorly conceived and executed action film that seems more like a highlight reel of Nicholas Hoult's attempt to be a solo action star.","10","Mystery & Suspense, Action & Adventure"
"collide_2017","Just a silly pastime","20","Mystery & Suspense, Action & Adventure"
"collide_2017","very good movie don't rely on rotten tomatoes","40","Mystery & Suspense, Action & Adventure"
"the_lego_batman_movie","One Of The Best Batman Movie In A Long Time.","50","Action & Adventure, Animation, Kids & Family, Comedy"
"the_lego_batman_movie","Not a fan of this movie it did not feel like a Batman movie because Batman did not fight joker and there we're different villains from different movies so this movie was not good boo!!!","10","Action & Adventure, Animation, Kids & Family, Comedy"
"the_lego_batman_movie","This movie had two scenes that were completely epic to watch: the clothes changing montage, and the 1960's back flash montage. The rest of the movie kind of lost me. It's still a very enjoyable film to watch, but in particular I liked the first Lego Movie the better .","30","Action & Adventure, Animation, Kids & Family, Comedy"
"the_lego_batman_movie","For a non-batman fan, I do love this movie. It was like base on a 90's kid playing lego batman that made into a movie. It has the humor same with the lego movie, I'm not quite sure if this movie is relatable to kids, it has a lot of adult humor onto it. As a full grown adult, it was such a hit to me. I wish they could make more of this Lego Movie franchise, like a Justice League version, perhaps?","40","Action & Adventure, Animation, Kids & Family, Comedy"
"the_lego_batman_movie","One of the best Batman films.","50","Action & Adventure, Animation, Kids & Family, Comedy"
"the_lego_batman_movie","The best Bruce Wayne story we've ever scene, Lego Batman offers the same fun, wit, and color the original movie possessed.","45","Action & Adventure, Animation, Kids & Family, Comedy"
"the_lego_batman_movie","Everything is dark and awesome!","50","Action & Adventure, Animation, Kids & Family, Comedy"
"the_lego_batman_movie","Liked it. Funny, but not as funny as the first Lego film.","35","Action & Adventure, Animation, Kids & Family, Comedy"
"the_lego_batman_movie","Excellently animated and super funny, but a touch too manic and dizzying at times takes some of its appeal away","35","Action & Adventure, Animation, Kids & Family, Comedy"
"the_lego_batman_movie","Well...at least it's better than the first Lego movie, but that ending regarding saving the city and me going WTF?","25","Action & Adventure, Animation, Kids & Family, Comedy"
"the_lego_batman_movie","Fun, but not as fun as the Lego Movie.","35","Action & Adventure, Animation, Kids & Family, Comedy"
"the_lego_batman_movie","This lego movie starts off with great satire but it slowly loses the way towards a family togetherness finale. The lego movie series is 2 for 2 and with another film due later this year, you would think the odds on their side. I liked the film and the humour, the voice work is incredible but a lot of those are lost in the midst of so many. If you're a Batman film you enjoy the interesting nods to 75 years of Batman history and some of those characters are laughably bad. Kids will enjoy the comedy but it is not just made for kids, the film will appeal to adults as well. I hope they continue with the spinoffs and there are so many they can do without direct sequels. The lego movie was extremely clever and this film is right up there but fails to stick the final third. 10-06-2017.","40","Action & Adventure, Animation, Kids & Family, Comedy"
"the_lego_batman_movie","This Batman movie works as an homage to all the Batman villains and also allies throughout its existence. It has a creative plot, reaching out to other villains from other universes such as Harry Potter, The Matrix, King Kong and The Lord of the Rings Trilogy. It has a lot of funny references and it is enjoyable to watch.","45","Action & Adventure, Animation, Kids & Family, Comedy"
"the_lego_batman_movie","As the second edition in the Lego Movie franchise, it's just as memorable or more so than the first Lego Movie. The theme is fantastic and it was super funny. I would recommend this to anyone all ages.","50","Action & Adventure, Animation, Kids & Family, Comedy"
"the_lego_batman_movie","Meh. I'd skip it. You'd think they could have done a much better job with the most interesting character from the Lego movie. The joke wears really thin in the first 5 minutes though, and then it's a sappy and poorly written movie.","20","Action & Adventure, Animation, Kids & Family, Comedy"
"the_lego_batman_movie","(R.I.P Adam West) The squeal to the modern hit 'The LEGO Movie'. The movie follows Batman (Will Arnett) adopting a young orphan named Dick Grayson (Micheal Cera). In which we see batman saving Gotham from villains, and learning about teamwork, family, and friends. The animation well done like the original, as well as the morals are told. However, it trys to much on pop culture refrences (which aren't all bad) with batman being plain meh. First of all, the animation is like the original not to fast, not to slow, not to hyper-realistic, but just right. The animation is wonky at times but, its passable. The star Batman trys so hard to be a mean guy, that it makes him ehhhh okay. Thanks to Will Arnett, it holds up to remind of the less mean batman from 'The LEGO Movie'. The lessons told in the movie will leave you feeling great as they are well told in the story. It shows the bounding of Batman and Dick being a good family, it can get weird at times, just ignore those parts. Finally, the large amount of pop culture references is scattered from Alfred's speech, to the big creatures in the final act of the film. Its wild, its fun, its nostalgic in many ways want a movie with pop culture from Warner Brothers? Overall, if Batman Had more personality, and if the movie had less pop culture references it would be better. The plus is the animation, morals, and the leads performance. 3 1/2 stars 72%","35","Action & Adventure, Animation, Kids & Family, Comedy"
"the_lego_batman_movie","Laughs a minute. Too funny even.","50","Action & Adventure, Animation, Kids & Family, Comedy"
"beauty_and_the_beast_2017","A Good Live Action Version Compared To The Original With All New Music And CGI.","40","Drama, Romance, Musical & Performing Arts, Science Fiction & Fantasy"
"beauty_and_the_beast_2017","its was okay. strange pick of characters","30","Drama, Romance, Musical & Performing Arts, Science Fiction & Fantasy"
"beauty_and_the_beast_2017","So very meh, I can honestly say, totally not my scene.","25","Drama, Romance, Musical & Performing Arts, Science Fiction & Fantasy"
"beauty_and_the_beast_2017","Casted perfectly and visuals were pretty awesome but must admit that I was slightly underwhelmed. I had really high expectations for this film but it didn't live up to the hype. Emma Watson is fun to look at however.","35","Drama, Romance, Musical & Performing Arts, Science Fiction & Fantasy"
"beauty_and_the_beast_2017","loved it ...will See it again and again","50","Drama, Romance, Musical & Performing Arts, Science Fiction & Fantasy"
"beauty_and_the_beast_2017","Are those songs really necessary? why talking with songs and dance without any reasons. Sometimes it feels like you are tickling me to laugh but it didn't work.","25","Drama, Romance, Musical & Performing Arts, Science Fiction & Fantasy"
"beauty_and_the_beast_2017","This movie would have been great if they didn't cast Emma Watson as Belle. I like her but she did not fit the Belle characters innocence and sweetness and the Be Our Guest Scene was tragic. Beast and Gaston did a wonderful job. Beautiful scenes but Emma just didn't speak to me. Her singing is awful as well.","30","Drama, Romance, Musical & Performing Arts, Science Fiction & Fantasy"
"beauty_and_the_beast_2017","Not spectacular, but still genuinely enjoyable. Some of the sets, directing, and cinematography weren't all that satisfying, but I still had a pretty decent time watching this. There wasn't really much that made this as memorable as the animated original. Each of the character portrayers had there decent moments, some different yet neat character restorations and story add-ons, as well as slight changes to the overall story as well. Not the greatest animated to real life concept, but still just okay.","35","Drama, Romance, Musical & Performing Arts, Science Fiction & Fantasy"
"beauty_and_the_beast_2017","This movie was well filmed and incredibly enjoyable! Emma Watson did a magnificent job portraying Belle and I would highly recommend it!!!!","40","Drama, Romance, Musical & Performing Arts, Science Fiction & Fantasy"
"beauty_and_the_beast_2017","Excellent live action remake to an animated Disney classic! Bought the movie on BluRay recently after seeing it in the theater a couple months ago. Pitch perfect casting of all the characters overall. Especially liked the performances of Emma Watson as Belle, Ewan McGregor as Lumiere, and Luke Evans as Gaston. Each brought their animated counterpart characters to life as well as could be imagined. Each member of the ensemble cast brought some realness and distinct personality to their characters in this live-action version. From the charm, fearlessness, independence, and radiance that Emma Watson represented and embodied into Belle. To the enthusiasm and pure fun that Ewan McGregor embraced with Lumiere. From the brashness and over-the-top entertaining persona Luke Evans brought to Gaston. The casting, acting performances, along with the CGI special effects, and the direction together combined to make this movie a magnificent success. For all the comments about auto-tuning the vocals of Emma Watson, it likely did happen. But they likely also did some level of auto-tuning for the other cast members vocals as well. But it honestly did not bother me. Some level of vocal enhancement, audio processing, and fine auto-tuning of recorded singing likely happens for movie musicals and audio recording studios for various performers. Not just for actors/actresses in movie musicals, but for studio music albums released for even the best musical artists. So some level of vocal sound production was likely done for the singing moments during this movie musical for the cast members to varying extents. In the end, this live action version 'Beauty & The Beast' will finish as one of the Top 10 grossing movies all-time revenue grosses earned at the box office. Both domestically and internationally worldwide overall. So based on those box office results, a vast majority people who saw this movie enjoyed, were entertained, and pleased with what they saw in the theaters. Amazing accomplishment to all involved in the movie for giving us an entertaining live action version of an animated classic that will be remembered for generations to come. Superb job!","50","Drama, Romance, Musical & Performing Arts, Science Fiction & Fantasy"
"beauty_and_the_beast_2017","To be honest, this movie disappointed me, in terms of overdoing things. I mean this movie was great, but it was a bit exaggerating","25","Drama, Romance, Musical & Performing Arts, Science Fiction & Fantasy"
"beauty_and_the_beast_2017","Only managed to watch about 10 minutes of this... and with much effort. It seems more like a Hollywood attempt at a bad Bollywood movie than the original classic. None of the human characters are likeable. The Plot: Belle is sick of her 'provincial' (read 'poor') life [she sings a whole song about it] but, then meets a super wealthy beast (read super wealthy ugly mo-fo) who takes her to Paris and wines and dines her in his massive castle - he also gives her a sizeable library without flinching. This leads her to fall in love with him (read his money) and that breaks the spell and he becomes good looking (in reality plastic surgery). All young girls should strive to find a rich man no matter how ugly he is","05","Drama, Romance, Musical & Performing Arts, Science Fiction & Fantasy"
