"Movie Title","Review","Score","Genres"
"john_wick_chapter_2","New John Wick movie that lives up to be a very good sequel to the original movie, with its beautiful, highly stylized set pieces, camera work and soundtrack. This is some kind of a new, 21st century noir.","40","Drama, Action & Adventure"
"john_wick_chapter_2","so good and amazing!","50","Drama, Action & Adventure"
"john_wick_chapter_2","Good entertaining, action Keanu Reeves movie just like the 1st John Wick.","50","Drama, Action & Adventure"
"john_wick_chapter_2","Yes, I know I only gave three stars....but you have to understand: 1. Dozens and dozens of bad guys can't be that bad of a shot 2. When you're beat up, tired, and bad guys still looking for you, you don't walk down the middle of a street / alley. This movie is basically the first movie with more death.","30","Drama, Action & Adventure"
"john_wick_chapter_2","Great action film some unrealistic action parts but it was very good","40","Drama, Action & Adventure"
"john_wick_chapter_2","AJohn Wick Chapter 2 delivers more of the slick action and world-building of the first film, but not without improved direction and craft.","45","Drama, Action & Adventure"
"john_wick_chapter_2","A decent follow up to the original that allows for an hour and a half or so of entertained popcorn munching.","30","Drama, Action & Adventure"
"john_wick_chapter_2","It was Awesome! ! Just as great as the first John Wick! A Must See!","50","Drama, Action & Adventure"
"john_wick_chapter_2","On par with the first one.","35","Drama, Action & Adventure"
"john_wick_chapter_2","Nearly everyone gets John Wick'd. His bullets are just harder I guess.","50","Drama, Action & Adventure"
"john_wick_chapter_2","1st movie was brilliant,2nd movie complete dog shit do not bother","10","Drama, Action & Adventure"
"the_ticket_2017","I really loved this movie. beautifully shot. very slow but I liked that. so many movies are rushed nowadays. it wasn't just about the dialogue, the director aloud the actors to express so much emotion without speaking. lots of long shots. a nice slow pace for a simple story with a strong message. Dan stevens is phenomenal. such an incredible performance.","40","Drama"
"the_ticket_2017","I enjoyed this movie, but I will say I am quite biased as the message the movie was trying to bring across was one I agreed with. Furthermore I have a preference for anything Dan Stevens does. The movie does leave much to be desired, the plot is quite predictable and it's definitely not a groundbreaking film. But again, I enjoyed it watching it.","50","Drama"
"the_ticket_2017","Plain simple and boring movie.","10","Drama"
"the_ticket_2017","So slow, so very slow. Dan Stevens is brilliant again though. [5/10]","25","Drama"
"the_ticket_2017","terrible movie. scenes dragged on. slow.","10","Drama"
"the_ticket_2017","Dan Stevens really transform into something that isn't Matthew Crawley hehe, he look so different, especially the chubbines on his cheeks are totally gone, i don't know what he's done to that. Loving his performance in here, such a great actor although the moral of the story is not new anymore but it's ok.","30","Drama"
"the_ticket_2017","Not sure what happened at the end.","20","Drama"
"the_ticket_2017","I usually don't disagree with the critics on movie reviews, however I strongly disagree with this one. The movie was so yes, but I found it has more positive aspects than negative. It was a tad rough around the edges but it didn't deserve the awful rating it got. It thought it was a great story and very well told by Dan Stevens.","50","Drama"
"the_ticket_2017","Boring!!! But I loved Dan Stevens","25","Drama"
"table_19","I am not sure why this movie is rated so low on rotten tomatoes . I usually stay away from reviewing movies , but I am doing it now because this movie really does have a very beautiful message on relationships and how people should treat each other . Happiness doesn't need perfection in people as long as they learn to learn to forgive and love each other .","50","Comedy"
"table_19","I thought I wasn't a fan of Anna Kendrick but I think I am now. I really enjoyed this movie. Pretty good love story people can relate to. It had twists that I did not see coming. Great actors and actresses. I liked seeing Craig Robinson get out of his comedy zone. Overall I would recommend it for anyone to watch.","45","Comedy"
"table_19","I normally wouldn't have picked Table 19 to watch, but I was glad I did. I enjoyed the movie. No, it wasn't overly complicated. It was funny, awkward, emotional and an enjoyable drama-rom-com movie. If you are fans of any of the cast, you'll likely enjoy it more because the ensemble worked well together.","40","Comedy"
"table_19","Well alot of people gave this film a mediocre review cause it does nothing brilliant, instead it does very simple things brilliantly. I enjoyed the normalcy and randomness of this movie, it had a lovable cast with relatable characters, it's no masterpiece but a great film to watch on a day you just want mild amusement and a couple moments of mundane reflection.","50","Comedy"
"table_19","I mean the movie is nice and heartwarming I guess but I don't think they had an idea whether they wanted to portray the father of the baby as good or bad seeing that he behaves as a jerk at times, at all It just got me confused. If the wedding crasher was getting married then there was no reason why they should've introduced his character","25","Comedy"
"table_19","Cute and funny, but light","30","Comedy"
"table_19","This may just be me, but I feel as though every film that Anna Kendrick attaches herself to instantly becomes watchable, due to the fact that her likability is always the most present thing in any film she's in. No matter how good or bad, her charming nature always has me finding something to like about the film. In this case, most critics have found Table 19 to be extremely hollow and have given it an overwhelmingly low score. I had been looking forward to this one for a while, but after reading a few reviews, I reserved myself and hoped for at least something enjoyable. Happily, this is one of the rare occasions where I have to disagree with the majority vote. Table 19 is a charming, harmless, one-location film with a lot of heart and here is why I believe it deserves some attention. Taking place almost entirely at a wedding, six random people have been placed at Table 19, which is the table that the leftovers/single people are placed at. All there for having some sort of relation to either the bride or groom, they are all strangers to each other. All having problems of their own, they form an unlikely bond and begin to find joy at a place that none of them really want to be at. With the addition of relationships falling apart or coming back together in surprising ways, Table 19 keeps its overall premise quite interesting from start to finish. Never once did I find myself bored, due to the very breezy 80-minute run time and the loveable cast of characters. I may be putting this film on a higher pedestal than it deserves, by stating that the sole reason this film is so good is due to the fact that the cast works terrifically together, but when a film desperately needs to do that in order for the story to work, not much else is needed here. This is such a simple one location premise, that it does just rely on its cast to carry it. Happily, everyone from the very talented Anna Kendrick, to the loveable June Squibb, to the pleasant sight of seeing Lisa Kudrow in the spotlight again, to seeing the very likely pairing of actors like Craig Robinson, Toni Revolori, and Stephen Merchant, there was a lot to love about these characters. Giving just enough backstory to each character during subtle lines of dialogue, I felt like I was getting to know all of them by the end of the film. There are only a few plot details set-up throughout the course of the first act, so it's very predictable when viewers finally reach the third act. This film is almost too simple for its own good, but that's one of the reasons why I enjoyed it so much. This a very short, very sweet, and very relaxed movie that tugs on just the right heart strings to leave you feeling very happy by the time the film ends. Some of the character decisions will bother a few people and the conclusion may not be exactly what everyone hopes for or frankly what may not suit the overall movie, but I quite enjoyed the conclusion and would honestly watch a television show with these characters at other events. That's truly how much I began to enjoy watching them on-screen. In the end, one-location films will always divide audiences for the most part. Some will be bored by the fact that it isn't exploring enough and other will find themselves loving the simplicity. I'm an avid filmgoer so I can accommodate my liking to either of the two. Table 19 has a fantastic cast of characters, therefore making for a very enjoyable viewing experience. It's most likely not going to be on my most-liked films of 2017, but it won't be one I'll soon forget, so that's more than a positive response coming from me. I really enjoyed my viewing of Table 19 and anyone who enjoys to relax and watch a simple movie that is very well-done, I have no problem giving this a recommendation. To my surprise, I think Table 19 is a great little movie.","40","Comedy"
"table_19","painfully dull and boring. storyline was ridiculously poor and characters were underdeveloped.","15","Comedy"
"table_19","Not nearly the happy go lucky movie I was anticipating... some very funny parts but kind of depressing as a whole.","30","Comedy"
"table_19","6.5/10~June 3,2017~","30","Comedy"
"table_19","I was very excited to see this movie after seeing the first trailer, but I'm sad to say that it didn't live up to expectation. With such a great cast I expected the acting to be very good all-around, but that wasn't the case. Anna Kendrick's performance felt inconsistent many times, Tony Revolori's character was extremely one dimensional and insufferable, June Squibb was decent, but it felt like she may have phoned it in for this movie. Lisa Kudrow, Craig Robinson, and Stephen Merchant were the shining characters and even Andy Daly was great in his small appearances. The dialogue at times felt dull and sometimes heavy-handed. The writers seemed to just throw in anything that they felt would have an emotional impact on the audience in the second half of the movie, but it doesn't work because they showed the characters to be annoying egotists in the first half. Overall, while the movie has some shining moments, they don't make up for it's many glaring flaws.","20","Comedy"
"table_19","I feel so sorry for Phoebe... (?)","05","Comedy"
"table_19","This movie was just plainly bad.","10","Comedy"
"table_19","Bit of a flat, unbelievable story line and not all that entertaining. The cast made it bearable.","30","Comedy"
"table_19","Did not figure out the twists until they hit me in the face. I liked being surprised. Unfortunately it did not manage to keep its pace, feels too slow at times - not all of these are quiet meaningful moments that drive the emotions home. It feels a bit jarring at times, the changes in pacing just feels like if the movie ran out of steam at inconvenient moments. Love the characters though and how bits and pieces were revealed as the movie progressed.","35","Comedy"
"table_19","Dysfunctional dining.","20","Comedy"
"table_19","Funny charming Wyatt Russell was great. Jo the nanny real hit my heart","30","Comedy"
"table_19","The movie has (not so new) potential but fell short of thrust especially with the tandem of the cast at table 19. It could've been better to knit how different their lives were or tackle some other different things but maybe it's just the story's way of trying to veer away from The-Breakfast-Club plot to such extent Eloise and Teddy's story may act as a stand-alone.","25","Comedy"
"table_19","Despite its all-star comedic ensemble, Table 19 provides no enjoyment through its humorless script and lazy characters.","20","Comedy"
"i_daniel_blake","beautiful but brutally honest","40","Art House & International, Drama"
"i_daniel_blake","I, Daniel Blake features a tour-de-force performance by Dave Johns, and it's one of the most powerful, exhilarating, and riveting films I've seen this year, and it's also one of the best films I've seen this summer.","50","Art House & International, Drama"
"i_daniel_blake","A touching yet scathing indictment of the bureaucratic social services system, one supposedly designed to aid its constituents but that's ultimately more concerned with rules, regulations and nitpicking than providing genuine care to the real people it's designed to serve. With excellent performances, a fine script and a directorial style aimed at showing more than telling, filmmaker Ken Loach's latest is well-deserving of all the accolades it has received. Despite a slight tendency to meander at times, this one is well worth your time, an inspiring tale about what we can do when our self-respect and personal dignity are on the line.","45","Art House & International, Drama"
"i_daniel_blake","Humbling and devastating and at times uncomfortable to watch. Immense performances from the two leads.","40","Art House & International, Drama"
"i_daniel_blake","successful was a heartfelt dramedy but nonsense as social commentary","30","Art House & International, Drama"
"i_daniel_blake","A must-see for all the clueless lefties who think the 'state' is the solution to anything! This is what the state always evolves into. Those who actually help Daniel do so out of kindness and charity. To hold a gun to peoples' heads and steal a large portion of their hard-earned income by force is wrong, no matter how well intentioned. If something is a good idea, then most people will willingly help those in need; too bad they've already been robbed by the state and wasted so much on a bloated government bureaucracy that there is little left for those truly in need. Socialism has never worked and the comeback is always, 'Well it's just never been done right before. THIS TIME we know better.' Most people are basically good and caring. Let them willingly donate to those who they know will efficiently help those truly in need, in stead of robbing them by force. The state's best interest is to create a large dependency class to perpetuate their power, albeit temporary as it eventually fails. Central planning is a failed notion, and billions of people each making mutually beneficial decisions in their own interest is far more efficient. Not perfect - there is no such thing - but in the long run best. Cooperation over coercion, freedom over fascism.","40","Art House & International, Drama"
"i_daniel_blake","Solid film exposing the dark side of the British nanny state to those who are unaware of how much hoop-jumping goes on and just how futile one is made to feel. This film could almost be described as a documentary as it is so close to the reality of what people face. Great film but not one which you can enjoy.","45","Art House & International, Drama"
"i_daniel_blake","Most un-Hollywood film in the theatres.","50","Art House & International, Drama"
"i_daniel_blake","One of Loach's best. Bleak, poignant ... the most un-Hollywood film in the theatres.","50","Art House & International, Drama"
"i_daniel_blake","The only film I have ever seen in my life that actually has a purpose and drives me to actually do something instead of sitting around and ignoring others as much as I can.","50","Art House & International, Drama"
"i_daniel_blake","Never seen a film that adequately depicts the horror of phone-in abusive discourse of our society run amuck. Comcast you suck. Throttle away our voices but there will be a reckoning.","50","Art House & International, Drama"
"i_daniel_blake","Better than I expected, though my expectations were low after seeing the trailer but this was a strong, heart warming and wrenching, realistic story about working class struggles in today's modern urban society and it's dealing with government services and life in general.","35","Art House & International, Drama"
"i_daniel_blake","film yang simple namun renyaah sekali dari awal sampe akhir!","40","Art House & International, Drama"
"i_daniel_blake","It's good simple movie to watch..","45","Art House & International, Drama"
"i_daniel_blake","Another fantastically real Loach movie that exposes the harsh but oft-ignored reality of so many people's lives and the culpability of a government that has lost any semblance of compassion for its less fortunate citizens - a damning indictment of a so-call modern day democracy told from the perspective of those who find themselves forgotten by their so-called leaders. I was actually so disturbed by what was happening to Daniel & Katie that I felt both angry and uncomfortable watching the almost inevitable end unfold. Must see viewing for all of us who are safe in our comfort-bubble of not worrying about where the money for our family's next meal will come from.","40","Art House & International, Drama"
"i_daniel_blake","A bleak and heartening portrait of modern poverty.","50","Art House & International, Drama"
"i_daniel_blake","Daniel who...some guy who cares?...only Rotten Tomatoes as usuall","05","Art House & International, Drama"
"i_daniel_blake","What can you expect from bureaucracy? It only quantifies a person as a case, if not a number. Ken Loach is far too manipulative here.","35","Art House & International, Drama"
"i_daniel_blake","The first 30 minutes frustrated me by feeling the need to throw the point down our throats and instead of allowing the natural stress of life shine through it felt the need to manipulate reality into its most moronic form, a little more subtlety would of gone a long way. The rest of the film however picked up from there and flowed in a much better fashion. The acting is without doubt the stand out winner for this film giving it a very human feel. It displays how those with nothing are often the most willing to give, and how the enphasis on systems and efficiency in modern society is often at the expense of the people they are supposedly there to help. Though the plot is not always elegant it's delivery is outstanding.","40","Art House & International, Drama"
"i_daniel_blake","Daniel Blake is the Everyman who is beat up, put down, discarded and ignored once he's not useful. This is worth a look.","40","Art House & International, Drama"
"a_united_kingdom","Beautiful story of love.","50","Drama, Romance"
"a_united_kingdom","'A United Kingdom' is a fascinating story that despite its minor issues is well told, well acted and has some terrific cinematography.","40","Drama, Romance"
"a_united_kingdom","A true story. A great cast. And yet a disjointed, schmaltzy, twee movie which lacks rhythm or anything to really captivate. Patchy direction, bristling with cliche and although the performances are perfectly good, it doesn't work. Felt like the story was seized upon and the film was worked in a systematic fashion. For a film about colour - it lacked colour.","20","Drama, Romance"
"a_united_kingdom","Apart from the actors and proposed story, there isn't much greatness to latch onto in A United Kingdom. This comes across as a low-risk telling of a story that must've been more riveting, passionate, and dramatic in real life. Not bad and crafted well enough, but when the safe avenue is taken with subject matter like this, it restrains the film by building a low ceiling.","30","Drama, Romance"
"a_united_kingdom","Despite its great performances and the relevance of the story it wants to tell, A United Kingdom is perhaps a bit too conventional to be memorable. Full review on filmotrope. com","30","Drama, Romance"
"a_united_kingdom","Feel good film with great acting and interesting plot","50","Drama, Romance"
"a_united_kingdom","Exceptional movie, well played with emotion and depth.Loved it","50","Drama, Romance"
"a_united_kingdom","Such a beautiful movie...based on a true story....shed a few tears....good cast....really well done!","45","Drama, Romance"
"a_united_kingdom","A fine true story with great performances from David Oyelowo and Rosamund Pike. Highly recommended!!","40","Drama, Romance"
"a_united_kingdom","This was a really awesome movie! I enjoyed the main characters' story and their love of each other thru such hardship.","40","Drama, Romance"
"a_united_kingdom","This movie made my cry for so many reasons. We've come a long way with blue global race relations, but we still have a long way to go.Wonderfully acted, fascinating plot. Was surprised that the majority of the plot was more about political intrigue than romance.","40","Drama, Romance"
"a_united_kingdom","Great true story. Certainly paints the government at the time in a very bad light. It's all about the money ...unbelievable.","50","Drama, Romance"
"a_united_kingdom","Solid period piece with a good story to tell. Especially enjoyed the emphasis on English imperialism and their command and control style with their colonies and territories. For me that was the true story here, not racism which I think the film tries to make the centerpiece. The movie visually was enjoyable to watch with a smooth ride up till the end. Definitely worth seeing.","40","Drama, Romance"
"a_united_kingdom","Beautiful performances, true story and restore faith that when you are true to your values, good things can happen.","50","Drama, Romance"
"a_united_kingdom","Although this movie may seem a story of racial bias and diplomatic ball game, it is really about a story of deep love. How it can overcome almost any adeversity life may throw at it. A very well crafted movie. One of the very best.","50","Drama, Romance"
"a_united_kingdom","Grade: A-Rating: PG-13, 111 minutesIn a Nutshell: Based on a true story, this lovely film illustrates how love and reason can change a crazy world. Bula! If you'd like to know more about the real people in this story, you can read Colour Bar: A United Kingdom by Susan Williams.Uplifting theme: Duty, honor, sacrifice, patience, tolerance, patriotismLove'We should not be fighting for segregation. We should be fighting for equality.' - Seretse Khama (David Oyelowo)'Africa can never be free until all those who live in her, white and black, recognize that race must have no bearing on equality and justice.' - Seretse Khama 'Opposition is one thing, Mr. Khama; the realities of government are quite another.' - Alistair Canning (Jack Davenport)'You have to be strong. You have a voice. Use it.' - Naledi (Terry Pheto)'No man is free who is not master of himself.' - Seretse'It is time!' - SeretseThings I liked:I had never even heard of Bechuanland. Have you? In 1966, it achieved independence and is now known as the Republic of Botswana. I'm always happy to learn new things in movies.I love seeing a proper marriage proposal when the man gets on one knee. Well done, Seretse. Nelson Mandela described the marriage between Seretse and Ruth as 'a shining beacon of light and inspiration.' Wouldn't that be amazing to have someone describe your marriage and legacy like that?David Oyelowo is absolutely fantastic in this. How about an Oscar for him? I also loved him in Selma. Great movie. Rosamund Pike is great in this also. She was crazy good in Gone Girl too, crazy being the key word in that sentence. Her subtle expressions say so much.Director Amma Asante has a bright future.The scene where the women sing a song to Ruth was so touching.I thought it was funny when Ruth's parents said, 'Mind yourself!' and 'Come back a missionary!' when she left the house. Things I didn't like:· There are some very ugly racial slurs and prejudiced behavior.· I've never understood parents who refuse to see their children again if they do something they don't like.· A lot of the Extras are terrible actors. Then again, they're natives who aren't actors.It's good to see Malfoy (Tom Felton) cast in another movie. Unfortunately, he plays an equally cruel, weaselly snake in this film too. Interesting lines:'He scares me a bit...the way he makes me feel.' - Ruth'I know I will never achieve anything there if I leave my heart here.' - Seretse'We'll take it moment by moment...together.' - Ruth'They're trying to define us, based on their rules, their idea of the world how they see it.' - Seretse'Let's not allow the ugliness of this world take away the joy from us.' - Seretse'Let him go. We need him more than you.' - Naledi'We've misjudged this, haven't we?'- Ruth'When a man tells a lie, he loses his dignity.' - SeretseFunny lines:'Did I ever tell you I didn't marry you just for your good looks?' - Seretse'Liar.' - Ruth (as she pulls up her skirt to reveal her beautiful legs.)Tips for parents: Some profanity.Some violence, bullying, and racism.Talk to your children about apartheid and segregation.There is some skin shown during a honeymoon moment.Some subtitles.Young children will be bored, but Tweens will be interested in the love story and historical telling.","45","Drama, Romance"
"a_united_kingdom","Nice piece of historical drama based on true events. The acting is top notch and the subject makes for a good right vs. wrong story. The cinematography is also top notch.","35","Drama, Romance"
