"Movie Title","Review","Score","Genres"
"land_of_mine","Both Møller and Zandvliet prove capable in their exploration of war, compassion and humanity. Land of Mine would prove a gripping watch to any viewer but is timed well for genre fans aching for new layers.","40","Art House & International, Drama"
"land_of_mine","One of the best movies!!!","50","Art House & International, Drama"
"land_of_mine","So difficult to watch, but I felt that I so needed to see it.","40","Art House & International, Drama"
"land_of_mine","Gripping, essential film that deals wonderfully with the brutality of war. Set in Denmark at the end of the Second World War we follow young German prisoners of war that are ordered to remove landmines from the Danish coastline. This film is superbly acted and expertly maintains tension and drama through out. There is redemption and pathos on show with great effect, resulting in a work of great art and tremendous heart.","40","Art House & International, Drama"
"land_of_mine","The expected clichés could not be avoided. There are good production values and the director brings out fine performances from the actors working through a familiar plot.","25","Art House & International, Drama"
"land_of_mine","A story of perpetual struggle and emotional hardship, Land Of Mine, a refreshingly clever title pun, documents the exploits of an oft-forgotten group of German World War 2 soldiers. Forced to clear the mines their own countrymen had planted along the Danish coast, while also facing up to the prejudice of those who previous fought against them, the movie does a stellar job of not only getting us to sympathise with the prisoners of war, but also care for them. Many of the mine disarming scenes are close to nail-biting, and whenever one of them goes off it's a genuine shocker, especially in the excellent training phase sequence. The Danish superiors often come across as one-dimensional villains with no redeeming values, with Roland Møller's resentful Sergeant being the only one which gets any development or moments of genuine humanity, but it's the only significant weakness I believe the film possesses. It's hard to believe the depicted events were condoned, considering that the young soldiers forced to clear the mines were conscripted at the tail end of the war, and as such had little chance to participate in any important battles. But the film demonstrates how prejudice can often be the most blinding feeling we have, particularly in a time of conflict. Frank, hard-hitting and illuminating, Land Of Mine is a war film which will likely never get the credit or attention it deserves, but if anything, that's even more of a reason to watch it.","45","Art House & International, Drama"
"land_of_mine","Land of Mine: More than 2000 German POWs were forced to clear nearly two million landmines from the beaches of Denmark following WWII. Most were teenagers and most died or were horribly maimed in the process. This gut-wrenching, 2017 Oscar nominee for Best Foreign Language Film is the story about a group of them. It is a film of juxtaposition - virtual children performing adult tasks, shockingly grisly deaths on a beautiful beach, and one-time oppressors who now are the oppressed. While the harrowing story is emotionally akin to two nerve-racking hours of Russian roulette, it is so exquisitely done with such powerful performances and a haunting score that it should be seen by everyone... but probably only once. A","45","Art House & International, Drama"
"land_of_mine","The film is gripping and tense enough to compensate for the main character's problems in characterization - especially his abrupt change in behavior towards the German boys, which comes off as forced and heavy-handed -, and it also benefits from a strong ending.","35","Art House & International, Drama"
"land_of_mine","Knowing that the key elements in this film will consist of German teenager POWs being forced to clear landmines, the brutal consequences are inevitable and there can be no mystery about what awful scenes it must contain. Its point is simple: this is no way to treat children regardless of how Hitler's Germany used them, or what they did in the war. It depicts the vengeful Allies as little better than the enemy, when they are subjecting the boys to inhuman labour, starvation, beatings and humiliation. Bridging the two worlds is the boys' commandant, a Danish sergeant who carries out his orders, but with degrees of compassion. The film begs the questions: what is the right punishment for an oppressor and how far down into the population should it have extended; at what point is following orders a defence to war crimes; how were these boys recruited or conscripted; what would these boys have become, if Nazi Germany had prevailed; what do they symbolise now. And, if the method of clearing the mines was the forced labour of the enemy, in the form of half-starved, sick, scared and degraded teenagers, what guarantee is there even now that the beaches and the other minefields of Europe are safe? The film's ending, while appropriate to the story, leaves the questions open. The Danish sergeant's way is to understand the past, and then to lock it away, never to be repeated, but the unknown factor is how many agree with him - then, or now.","35","Art House & International, Drama"
"land_of_mine","It was a good reminder of events and the joy brought to many","45","Art House & International, Drama"
"land_of_mine","Insightful and thoughtful character- development makes this film exceptional, possibly even unique","50","Art House & International, Drama"
"land_of_mine","Solid story, pretty different war film, or post war film. Exciting all the way, as you can expect when the plot basicly is land mine clearing in Denmark. It's done by German soliders. Young ones, probably war prisoners or something. They are not very popular fellas so people never care about their very dangerous work. They don't care if most of them die, they only want it done.Great location, lovely visuals and some nice editing. Very solid acting once again from Roland Møller. He's becoming one of my Danish favorites, really.It's a bit predictable, that kills a bit of the vibe, but not too much. In total it's a very solid historical drama. 'Krigen', another Danish war film done the same year was another very solid film. Very different as they were sat 70 years apart or so, but the race between the two of being the best film is darn close for me.7 out of 10 beetles.","35","Art House & International, Drama"
"land_of_mine","Very good movie with an emotional story to tell.","40","Art House & International, Drama"
"land_of_mine","An intensely emotional and human film, that tackles the subject of a man's uniform and what's under it very delicately and in the way it should be. The film suffers a bit of predictability and it could have used a longer running time: it would have helped unfold the story and develop character relationships even further. These minor problems aside Land of Mine is an astounding and beautifully shot film.","45","Art House & International, Drama"
"aftermath_2017","Some one should apologize for this movie. Bad, Bad, Bad!","10","Mystery & Suspense, Drama"
"aftermath_2017","Good story just could have been alot better. Jumped from one side to the other. Director trys to make you feel the characters emotional struggle but it only makes for a boring 3/4 of movie. The ending was was good just time line jumps","15","Mystery & Suspense, Drama"
"aftermath_2017","If the ending was better this could have been a really good movie. I liked the acting and the mood, but the last 15 or 20 minutes really killed it.","30","Mystery & Suspense, Drama"
"aftermath_2017","Sad but good movie! Cast is good! A bit slow n predictable but I'd watch it again.","30","Mystery & Suspense, Drama"
"aftermath_2017","'Oh Arnold, this is what the 'Aftermath' looks like when you terminate your 'Celebrity Apprentice' hosting duties and bash Donald Trump by simply offering him to switch jobs'Movie Review: AftermathDate Viewed: June 8 2017Directed By Elliott Lester (Blitz and Nightingale)Written By Javier GullónStarring: Arnold Schwarzenegger, Scoot McNairy, Maggie Grace, Judah Nelson, Martin Donovan, Hannah Ware, Mariana Klaveno, Kevin Zegers, Glenn Morshower, Larry Sullivan and Teri Clark Linden.Oh Arnold, this is what the 'Aftermath' looks like when you terminate your 'Celebrity Apprentice' hosting duties and bash Donald Trump by simply offering him to switch jobs. 'Aftermath' is a drama so broody and very bleak, it feels unfocused and out of place. Arnold Schwarzenegger is trying very hard to be a compelling actor with dramatic range but he fails miserably thanks to a very weak screenplay. The first act of the movie is well drawn but the rest of 'Aftermath' feels like it came from depressing therapy sessions.Inspired by actual events, Arnold plays Roman Melnik, a construction foreman who delightfully gets out of work early because his wife and daughter are coming to visit him. Unfortunately for Roman he gets very sad news, his wife and daughter were killed in a devastating plane crash. Their plane colluded with another plane, both aircrafts crashed into the ground and there are no survivors.Next we cut to another stranger, Jacob 'Jake' Bonanos (Scoot McNairy), the air traffic controller who's labeled responsible for this major airplane collusion and he too is also devastated. Jake blames himself for the deaths of all 271 passengers who were on board those two flights and he slips into a deep depression. His depressed state is so deep, he doesn't know how to cook scrambled eggs and it also takes a toll on his wife, Christina (Maggie Grace) and son, Samuel. The fatal air traffic error not only destroys Jake's life, his house gets sprayed with words such as killer and murderer. Meanwhile, as Roman grieves over the deaths of his wife and daughter, he only has one motive now and that is revenge.Director Elliott Lester's (Blitz and Nightingale) film does have emotional tendencies but what's missing here is character development and a real story that knows how to deal with guilt and self-pity well. We all know that the former governor of California is trying to win the public back by making small, devastatingly grim dramas but 'Aftermath' is the kind of low-rent film you would normally find at your local pharmacy or grocery store for $9.99.Don't get down on your luck Arnold, you just need to 'GET TO THE CHOPPA!' and find scripts that will value your dramatic chops.","20","Mystery & Suspense, Drama"
"aftermath_2017","Schwarzenegger and McNairy give tremendous performances while the crew deliver inspired visuals, editing and sound design. It's a brutal and realistic film that doesn't sugar coat the harsh truth of its events and characters. Personally, I've this stage in Schwarzenegger's career, with him taking on more dramatic and subtle roles like this and 'Maggie'. I also recommend that after seeing them film, viewers should read up on the real life events and people that inspired the film.","50","Mystery & Suspense, Drama"
"aftermath_2017","Some great acting, especially from McNairy and surprisingly from Arnold as well. The story is gutwrenchingly tragic and considering it's a true story makes it all the worse. Some choices are made by the characters that makes it harder to sympathise with them, but it's quite human reactions and I appreciate that.","35","Mystery & Suspense, Drama"
"aftermath_2017","Schwarzenegger in ok grief drama.","20","Mystery & Suspense, Drama"
"aftermath_2017","A film that depicts the struggle of life after losing part of your family in a tragic way and the mental struggle that comes with it. Personally, I enjoyed Aftermath. Its dark, has real and raw emotion, decent acting and script. It's not a hidden gem but it is a solid film to check out. The third act I didn't expect and didn't see coming and it savored it from being subpar, barely ok. I enjoyed Aftermath and in my opinion was a decent watch, I'd ignore the critics.","30","Mystery & Suspense, Drama"
"aftermath_2017","Disappointingly made film about a subject which could have been so much better handled.","20","Mystery & Suspense, Drama"
"aftermath_2017","Oh Arnold. What a sad, pathetic man you have become.","05","Mystery & Suspense, Drama"
"aftermath_2017","A complete boring, slow, lame, lazy, generic and forgettable approach of the real accident. Arnold Schwarzenegger still can't find his dramatic tone, he has simply not much of dramatic acting skills. While Scoot McNairy manages to elevate the movie minimally, it isn't enough to save this. People who were expecting an ambiguos thriller will be disappointed.","10","Mystery & Suspense, Drama"
"aftermath_2017","I love Arnold as everybody knows me knows that, and his acting was great in my opinion, as it was in one of his other recent dramas, Maggie. However, the films sluggish pace unfortunately made the movie kind of dull overall. There could have been some scenes put in to beef up the tension (a court scene where the airline TC found not guilty, arnold flips). Not a bad watch but don't expect Mr. Box office action Arnie.","30","Mystery & Suspense, Drama"
"aftermath_2017","The performances of Arnie and McNairy makes this tolerable but it was like watching one of those straight to video Oddessey films that plauged the shelves of rental shops in the 80's and 90's.","20","Mystery & Suspense, Drama"
"aftermath_2017","This is truly a helpful movie if you want to learn about trauma and how it affects human's life...","50","Mystery & Suspense, Drama"
"aftermath_2017","2 1/2 ud af 5 kontroltårne. Historien bygger på en kendt sag fra Europa, hvor en russisk mand dræbte en dansk flyveleder i schweizisk tjeneste, fordi han mente, han var skyld i hans families død ved et sammenstød i luften over Bodensøen. En gennemlæsning af de amerikanske anmeldelser på Rotten Tomatoes viser, at ingen derovre kender til den oprindelige historie, som i filmen er omplantet til USA. Drabsmanden er dog stadig russer (immigrant) og spilles af Arnold, som altså her tager springet til karakterskuespiller. Det skulle han ikke have gjort. Filmen er gumpetung og og deprimerende, og Arnold formår slet ikke at formidle den dybe sorg, der ender med at gøre ham til drabsmand. Flyvelederen portrætteres til gengæld rimelig troværdigt af den forholdsvis ukendte Scott McNairy.","25","Mystery & Suspense, Drama"
"aftermath_2017","Great acting and story.","50","Mystery & Suspense, Drama"
"aftermath_2017","Depressing and boring","15","Mystery & Suspense, Drama"
"aftermath_2017","A decent sad story inspired on actual events. It kept my interest.","30","Mystery & Suspense, Drama"
"fist_fight_2017","BEST COMEDY . the jokes here r amazing the fight incrdable. This movie was not meant to give u a story more like spmething u can enjoy without givinga shit","50","Comedy"
"fist_fight_2017","The actors try their best with a very poor script. Charlie Day is becoming one of the funniest actors today and the fight scene is surprisingly really good","25","Comedy"
"fist_fight_2017","You have to wait until the final 10 minutes for the actual fight, but until then, you don't laugh much and the movie is a drag.Grade: C-","20","Comedy"
"fist_fight_2017","Hilarious but it depends what kind of comedy you like. I think this is a movie you can't judge based on ratings","35","Comedy"
"fist_fight_2017","Shits funny I don't care who you are. Charlie Day and Ice Cube kill it with the comedy. These scores do not reflect how funny this movie is.","45","Comedy"
"fist_fight_2017","It was good.. several funny moments.. great cast.","40","Comedy"
"fist_fight_2017","One of the worst movies i ever saw. This kind of comedy is bizarre. Everything that hapens in the movie is absolutely terrible to accept.","10","Comedy"
"fist_fight_2017","Very dumb but I laughed a lot. Charlie Day is just so funny. Ice Cube is Ice Cube","40","Comedy"
"fist_fight_2017","6/4/2017: Pretty disappointing. It had potential, but there weren't many funny moments.","20","Comedy"
"fist_fight_2017","Looks like a genetic-superior issue in another parallel-universe United States where you morally swear your ass off or get physical and yet stay cartoonlike invincible. It's definitely fanbased between these two actors that show courage and invincibility even if the script doesn't go to another level of sheer lunacy, like using tradesmen tools and machines such as a chainsaw, as in zombie-killing ::","25","Comedy"
"fist_fight_2017","Not very funny at all, and dumb storyline. So disappointing cos I love watching both actors!","20","Comedy"
"fist_fight_2017","Nothing really new here but I loved the character change in charlie day. Ice Cube is his old self that works for him in many movies, and the supporting cast are all good. The fight at the end was really funny too. Overall, fairly good!","35","Comedy"
"fist_fight_2017","One of the worst films I've ever seen, unfortunately.","05","Comedy"
"fist_fight_2017","up front and center with its craziness which gives it an odd charm","30","Comedy"
"fist_fight_2017","This was one of the worst movies I have ever seen.","05","Comedy"
"fist_fight_2017","Movie was cheesy and comical and exactly what I was expecting. I actually enjoyed this movie unlike the other reviewers here. The movie also carried a good morale with a decent theme.","40","Comedy"
"fist_fight_2017","So slow, unfunny and boring. This was such a poorly written, unoriginal film.","05","Comedy"
"fist_fight_2017","This movie is way better than I thought it would be and really has any right to be... and there's also sort of a message in there.","30","Comedy"
"fist_fight_2017","Typical....raunchy, crude, and occasionally funny.","20","Comedy"
"alone_in_berlin","My opinion-.This movie of Vincent Perez was for my part very well realized and it knew how to draw the maximum of right emotions by strong images, making this beautiful thriller dramatic. Emma Thompson, Brendan Gleeson, Daniel Brühl, who gave their full performances to this movie based on this true story. It evokes German resistance to the Nazi regime and the conditions of survival of German citizens during the Second World War. It is based on the real story of Otto and Elise Hampel, executed on April 8, 1943, at the Plötzensee prison for acts of resistance and whose file at the Gestapo was transmitted to Hans Fallada after the war. Realistically, this movie, based on the novel by Hans Fallada published in 1947, which denounces the barbarity and cruelty of the Third Reich, the baseness of human nature subjected to fear and hatred and emphasizes the courage of A few who, in order to remain in harmony with their conscience and contribute to the destruction of that regime, were ready to give their lives. Moreover in this film, there are very beautiful scenes really moving especially, one advances in this movie and the final scenes are magnificent of power. A strong movie in every respect.","40","Drama"
"alone_in_berlin","The world has been asking the Germans why they supported the Nazis. The Germans honestly answered in the 1947 book by Hans Fallada Jeder stirbt für sich allein. (It was one of a few books in the tiny post-war library of my Polish parents. Primo Levi called it 'the greatest book ever written about German resistance to the Nazis'). But the world failed to listen and/or understand. While translated into Russian and Polish before 1950, the English version was produced in 2009, by the Americans, under inadequate title Every Man Dies Alone). So, in Alone in Berlin the Germans are explaining again, trying to make themselves understood by changing the victim from brother to son, and the language from German to English. In vain; the incredibly insensitive incompetence of the world film critics finds the story... boring. The monotony of daily avoidance of terror and death...boring. Banality of Truth. If you ever asked yourself what it would be like to live in Berlin 1939-1945, Alone in Berlin will tell you.","50","Drama"
"alone_in_berlin","Emma Thompson and Bendan Gleeson do a good job of playing Anna and Otto Quangel in this suspenseful drama. And Daniel Brühl (Inglorious Bastards) puts in a nuanced, compelling performance as the police detective. I liked ALONE IN BERLIN because it focuses on two ordinary German civilians who carry out such a simple subversive activity. We see so many stories of dramatic heroism - but this one is about people just doing what they can to protest. The story is told in a straightforward way with no sensationalism and very little action - and yet, it communicates the constant anxiety that people must have felt during the Nazi regime when you couldn't trust anyone - even your closest friends.","40","Drama"
"alone_in_berlin","I watched this movie because I'll be going to Berlin soon, just wanted to see what it was like back then and because Emma Thompson was in it. Didn't expect much; couldn't find much.","25","Drama"
"alone_in_berlin","a beautifully made film","45","Drama"
"alone_in_berlin","A little slow for my taste...........","25","Drama"
"alone_in_berlin","Slow and drawn out movie, but excellent acting and being a true heroic story makes it well worth watching.","40","Drama"
"alone_in_berlin","This was a moving & also suspenseful account of the lives of ordinary people during the Nazi regime. Wonderful performanced grom Emma Thompson & Brendan Gleeson. I think I would have preferred to see it in German with sub-titles, but definitely worth watching...surprised at all the negative reviews!","40","Drama"
"alone_in_berlin","A tender story of a man & wife dedicated to spread the word of hope & exposure of the lies of the Nazi Party by placing cards around the city of Berlin.Naturally this garners attention of the SS but they are unable to identify the culprit. Sadly both Brendan Gleason & Emma Thompson lack chemistry & the film is interesting but not enthralling.I feel the Nazi stories are becoming a tad cumbersome & this may have felt that sting. May have worked better as a documentary, sadly not that memorable.","25","Drama"
"alone_in_berlin","I don't understand the hate for this movie, I thought it was delicate and compelling. A well acted story that holds new importance today!","40","Drama"
"alone_in_berlin","Excellent acting, sad, engrossing","50","Drama"
"alone_in_berlin","Thompson and Gleason give their usual stellar performances but I wish I could say the same thing about the director.","35","Drama"
"alone_in_berlin","A good enjoyable film.","35","Drama"
"alone_in_berlin","Should be better if the movie was not in English. Presumably German should make it more realistic despite it was based on real story during WWII. There were good Germans who also suffered and sacrificed in their own country during that time. Unfortunately their stories were not known.","20","Drama"
"alone_in_berlin","I'm seriously disappointed at the ending after reading the book. I can forgive editing out certain characters because of the length of the film but I can't get over what they did to the ending. They didn't change it as such, they just ended the film earlier. :(","20","Drama"
"alone_in_berlin","A beautiful gesture to the human free spirit that is able to connect to courage and resistance even under the most terrible and frightening circumstances. Hans Fallada's book receives full recognition allowing even those for whom books are less accessible to learn this important historical true story. Let's hope that even if postcards made little impact during second world war Germany, the movie will have a more powerful impact in our own time encouraging less obedience and more manifestations of critical thought. And of course Emma Thompson is excellent as always.","50","Drama"
"alone_in_berlin","Found it very moving, excellent movie","40","Drama"
"alone_in_berlin","While beautifully filmed and acted, the movie didn't evoke sympathy with the main characters. It also lacked a sense of urgency which made the pacing on the movie very slow.","25","Drama"
"john_wick_chapter_2","An Actually Good Sequel With Keanu Reeves That Will Hopefully Go Into Another Sequel.","50","Drama, Action & Adventure"
"john_wick_chapter_2","Not quite as tight, punchy and elegant as the first, but still hyper-gore, mega action, amazing set-piece action fury like the first. An absolute must watch for fans of the genre.","40","Drama, Action & Adventure"
"john_wick_chapter_2","In the theater crowd started of perfectly quiet. I'd say by the halfway point people were high fiving each other and everyone was just just going nuts. I love this movie, if you like action movies you will love this movie. Reeves is amazing and the fact that he does all his own fight sequences just makes it look even better. The locations and scenery look amazing and the world they have","50","Drama, Action & Adventure"
"john_wick_chapter_2","This is a Bad movie. John Wick was great entertainment this step-child of a movie is a complete waste of time and any money spent on it. This sequel is horrible. Same crap, over and over and over again. Little like all the sequel's to the original Matrix movie. How can people watch this drivel?","05","Drama, Action & Adventure"
"john_wick_chapter_2","Just damn good shoot them (everyone) up type movie.","50","Drama, Action & Adventure"
"john_wick_chapter_2","I enjoyed this movie more then the last one. The motivation was not as good in this movie, but the action was great and the movie left me wanting more.","45","Drama, Action & Adventure"
"john_wick_chapter_2","This deserves a thumbs up for the stunt work alone. On top of that it was awesome overall.","45","Drama, Action & Adventure"
"john_wick_chapter_2","Not as good as the first but still plenty good. John Wick kicking butt and taking names.","35","Drama, Action & Adventure"
